{"task_id":"TASK-20260430-005","agent":"Validator-A","tool":"Codex CLI","tier":"Tier2","verdict":"FAIL","criteria_results":[{"criterion":"node --check passes for changed scripts.","result":"FAIL","detail":"Could not independently execute node --check in this read-only validation session because node execution was blocked, and no validation-evidence artifact was present to support the claimed pass."},{"criterion":"npm run audit:harness passes.","result":"FAIL","detail":"Could not independently execute npm/audit in this validation session because node execution was blocked, and no validation-evidence artifact was present to support the claimed pass."},{"criterion":"Regression coverage detects duplicate ledger event_id and malformed Validator-B output handling.","result":"PASS","detail":"Static inspection found max-suffix allocation in scripts/lib/ledger-events.mjs, duplicate event_id detection in scripts/validate-ledger.mjs, MALFORMED_OUTPUT Resource Failure handling in scripts/run-validator-b.mjs, and regression checks in scripts/check-validator-b-regressions.mjs."},{"criterion":"Validator-A PASS is recorded before main merge.","result":"FAIL","detail":"This Validator-A run is FAIL, so PASS cannot be recorded before merge."},{"criterion":"reports/TASK-20260430-005.md and quality score are written.","result":"FAIL","detail":"reports/TASK-20260430-005.md is absent and logs/quality-scores.jsonl contains no TASK-20260430-005 entry."}],"errors":[{"severity":"HIGH","evidence_type":"SPEC_MISMATCH","location":"reports/TASK-20260430-005.md; logs/quality-scores.jsonl","description":"The required final report and quality score were not written, violating the explicit success criterion.","suggestion":"Create reports/TASK-20260430-005.md and append a TASK-20260430-005 quality score entry to logs/quality-scores.jsonl, then update the task ledger with the report artifacts.","evidence":"Test-Path reports\\TASK-20260430-005.md returned False; Select-String -Path logs\\quality-scores.jsonl -Pattern TASK-20260430-005 returned no matches; reports directory listing had no TASK-20260430-005.md."},{"severity":"MEDIUM","evidence_type":"EXECUTION_PROVEN","location":"validation session command execution","description":"Required validation commands could not be independently executed in this Validator-A session, and no linked validation-evidence artifact was available as supporting evidence.","suggestion":"Rerun node --check for the changed scripts and npm run audit:harness in an environment where node execution is permitted, or provide a validation-evidence artifact with command, exit code, and output summaries for Validator review.","evidence":"Attempts to run node --check scripts\\run-validator-a.mjs, scripts\\run-validator-b.mjs, scripts\\validate-ledger.mjs, and scripts\\audit-harness.mjs were rejected by policy as blocked command execution. The handoff directory listing did not include validation-evidence.json."}],"github_commit":null,"tier_reclassification_needed":false,"tier_reclassification_reason":null,"log":[{"timestamp":"2026-04-30T00:00:00+09:00","action":"inspect_prerequisites","result":"Read AGENTS.md, ARCHITECTURE.md, SECURITY.md, and docs/agents/validator.md."},{"timestamp":"2026-04-30T00:00:00+09:00","action":"inspect_handoff_inputs","result":"Read Task Spec, Generator result, TASK-20260430-005 ledger, and validator-result schema."},{"timestamp":"2026-04-30T00:00:00+09:00","action":"inspect_changed_files","result":"Reviewed git status, git diff for changed tracked files, new ledger-events helper, and Validator-B regression script."},{"timestamp":"2026-04-30T00:00:00+09:00","action":"verify_required_artifacts","result":"Confirmed reports/TASK-20260430-005.md and TASK-20260430-005 quality score entry are missing."},{"timestamp":"2026-04-30T00:00:00+09:00","action":"attempt_execution_checks","result":"node --check execution was blocked by policy; npm audit was not run because node execution was blocked."}]}