{"task_id":"TASK-20260430-002","agent":"Validator-A","tool":"Codex CLI","tier":"Tier2","verdict":"FAIL","criteria_results":[{"criterion":"run-validator-b no longer passes the full prompt as a CLI argv value.","result":"PASS","detail":"Static review shows the Gemini prompt body is supplied via spawnSync option input: prompt, while argv contains only a short --prompt instruction."},{"criterion":"run-validator-b rejects sandbox modes other than read-only.","result":"FAIL","detail":"The script rejects non-read-only args.sandbox values, but the Gemini CLI argv it constructs contains --sandbox without the required read-only value, so the actual child process is not explicitly constrained to read-only."},{"criterion":"run-validator-b applies a total embedded context byte budget and marks omitted files.","result":"PASS","detail":"Static review shows maxEmbeddedContextBytes, a shared budget object, and omitted_for_total_budget status handling in readContextFile/buildReviewContext."},{"criterion":"run-validator-b rejects Validator-A/Codex references in refs and changed_files, not just selected phrases.","result":"PASS","detail":"Static review shows assertValidatorBIndependence scans refs, changed_files, and previous_failures with /validator[-_]?a|codex/i."},{"criterion":"run-validator-b prompt includes the validator-result schema content or an equivalent schema contract.","result":"PASS","detail":"Static review shows systemInstruction reads docs/schemas/validator-result.schema.json and embeds it inside validator_result_schema_json tags."},{"criterion":"run-validator-a validates github_commit and tier_reclassification_reason as required result fields.","result":"PASS","detail":"Static review shows validateValidatorResult requires github_commit and tier_reclassification_reason."},{"criterion":"validate-handoffs discovers Validator-B fixtures without a single task-specific hardcode.","result":"PASS","detail":"Static review shows collectFiles recursively discovers validator-b-input.json under tasks/handoffs and tasks/fixtures; no TASK-20260430-specific Validator-B fixture hardcode was found."},{"criterion":"node --check, Validator-B dry-run, audit:harness, and Validator-A validation pass.","result":"FAIL","detail":"Parent validation evidence reports passing commands, but the recorded Validator-B dry-run command shape includes --sandbox without read-only, matching the static defect in run-validator-b. Local node/npm execution was blocked by sandbox policy, so this was validated statically against the referenced files and evidence."}],"errors":[{"severity":"HIGH","evidence_type":"STATIC_PROVEN","location":"scripts/run-validator-b.mjs:commandArgs","description":"Validator-B constructs a malformed Gemini CLI sandbox argument. commandArgs validates args.sandbox but returns cliArgs with '--sandbox' and never appends args.sandbox, so a live Gemini invocation receives no explicit read-only sandbox value.","suggestion":"Append the sandbox mode to the Gemini argv, for example include '--sandbox', args.sandbox in cliArgs, and update the dry-run/audit evidence to assert the command shape contains '--sandbox read-only'.","evidence":"In scripts/run-validator-b.mjs, commandArgs builds cliArgs as ['--prompt', stdinPromptInstruction, '--output-format', 'json', '--sandbox']; the only later conditional append is '--model', args.model. The spawned command uses cliArgs directly, so read-only is not passed to Gemini."},{"severity":"MEDIUM","evidence_type":"SPEC_MISMATCH","location":"tasks/handoffs/TASK-20260430-002/validation-evidence.json","description":"The validation evidence accepts a Validator-B dry-run command shape that is missing the sandbox mode value, so the evidence does not prove the read-only Validator-B invocation required by the Task Spec.","suggestion":"Rerun Validator-B dry-run after fixing commandArgs and record evidence that the printed command includes '--sandbox read-only' while still keeping the full prompt out of argv.","evidence":"validation-evidence.json summarizes the dry-run command shape as 'only a short --prompt instruction plus --output-format json --sandbox'; it does not include the required read-only value."}],"github_commit":null,"tier_reclassification_needed":false,"tier_reclassification_reason":null,"log":[{"timestamp":"2026-04-30T00:00:00+09:00","action":"READ_TASK_SPEC","result":"Loaded tasks/specs/TASK-20260430-002.json and validated Tier2 success criteria scope."},{"timestamp":"2026-04-30T00:00:00+09:00","action":"READ_GENERATOR_RESULT","result":"Loaded tasks/handoffs/TASK-20260430-002/generator-result.json and changed-file list."},{"timestamp":"2026-04-30T00:00:00+09:00","action":"STATIC_REVIEW","result":"Reviewed run-validator-b, run-validator-a, validate-handoffs, audit-harness, Validator-B input, and validation evidence."},{"timestamp":"2026-04-30T00:00:00+09:00","action":"EXECUTION_ATTEMPT","result":"node/npm validation commands were blocked by sandbox policy in this Validator-A session; parent-session evidence was considered but the static sandbox argv defect remains failing."}]}