{"task_id":"TASK-20260430-002","agent":"Validator-A","tool":"Codex CLI","tier":"Tier2","verdict":"FAIL","criteria_results":[{"criterion":"validation setup","result":"FAIL","detail":"Unable to perform validation because the response format was prematurely constrained before repository evidence could be inspected."}],"errors":[{"severity":"CRITICAL","evidence_type":"SPEC_INTERPRETATION","location":"session","description":"The validator response format constraint prevented required read-only repository validation steps from being executed.","suggestion":"Re-run Validator-A without prematurely emitting the final schema before inspecting the referenced spec, generator result, and changed files.","evidence":"No repository files were inspected in this run."}],"github_commit":null,"tier_reclassification_needed":false,"tier_reclassification_reason":null,"log":[{"timestamp":"2026-04-30T00:00:00+09:00","action":"validation_aborted","result":"response schema emitted before evidence collection"}]}