{"task_id":"TASK-20260430-005","agent":"Validator-A","tool":"Codex CLI","tier":"Tier2","verdict":"FAIL","criteria_results":[{"criterion":"Session preflight","result":"FAIL","detail":"Validation could not be performed because the assistant response channel was constrained to the final validator JSON object before repository inspection could occur."}],"errors":[{"severity":"CRITICAL","evidence_type":"SPEC_INTERPRETATION","location":"session","description":"Unable to inspect the referenced Task Spec, Generator result, ledger, schema, or changed files within this response because the required final output format was invoked prematurely.","suggestion":"Rerun Validator-A in a fresh read-only session and inspect the referenced files before producing the final validator-result JSON.","evidence":"No repository validation commands were executed before this result."}],"github_commit":null,"tier_reclassification_needed":false,"tier_reclassification_reason":null,"log":[{"timestamp":"2026-04-30T00:00:00+09:00","action":"validation_aborted","result":"No file inspection performed before final JSON emission."}]}