{
  "task_id": "TASK-20260430-001",
  "agent": "Validator-A",
  "tool": "Codex CLI",
  "tier": "Tier2",
  "verdict": "PASS",
  "criteria_results": [
    {
      "criterion": "package.json exposes a run:validator-b command.",
      "result": "PASS",
      "detail": "package.json defines \"run:validator-b\": \"node scripts/run-validator-b.mjs\"."
    },
    {
      "criterion": "scripts/run-validator-b.mjs exists and can execute in dry-run mode without invoking Gemini.",
      "result": "PASS",
      "detail": "scripts/run-validator-b.mjs exists. Static inspection shows --dry-run returns before spawnCommand and before artifact/ledger writes; validation-evidence.json records the dry-run command exited 0."
    },
    {
      "criterion": "Validator-B runner writes normalized run metadata and result artifacts under tasks/handoffs/{TASK-ID}/.",
      "result": "PASS",
      "detail": "Non-dry-run paths are derived from the task handoff directory and include validator-b-run-<attempt>.json, validator-b-stdout-<attempt>.json, validator-b-stderr-<attempt>.log, validator-b-prompt-<attempt>.txt, and the expected validator-b-result*.json output."
    },
    {
      "criterion": "Validator-B runner rejects handoffs with agent values other than Validator-B.",
      "result": "PASS",
      "detail": "parseHandoff throws unless data.agent is exactly \"Validator-B\"."
    },
    {
      "criterion": "Validator-B runner performs the same common secret-like payload preflight as Generator and Validator-A before invoking a model CLI.",
      "result": "PASS",
      "detail": "The runner imports assertNoSecretLikeContent from scripts/lib/secret-scan.mjs and applies it to the raw handoff, included context files, and final Validator-B prompt before Gemini invocation."
    },
    {
      "criterion": "Harness audit includes Validator-B pipeline checks.",
      "result": "PASS",
      "detail": "scripts/audit-harness.mjs checks for the package command, Validator-B-only guard, Validator-A independence guard, and Validator-B prompt secret preflight marker; scripts/validate-handoffs.mjs also validates the Validator-B fixture."
    },
    {
      "criterion": "Relevant guides no longer imply Validator-B is missing after implementation.",
      "result": "PASS",
      "detail": "docs/guides/validator-pipeline-ko.md documents run-validator-b.mjs, Gemini CLI command shape, dry-run, resource-failure handling, and independent handoff requirements. docs/guides/generator-pipeline-ko.md now states the Validator-B wrapper is implemented and only live smoke remains."
    },
    {
      "criterion": "node --check and npm run audit:harness pass.",
      "result": "PASS",
      "detail": "Direct node/npm execution was blocked by this Validator-A runtime policy, but tasks/handoffs/TASK-20260430-001/validation-evidence.json records exit_code 0 for node --check scripts/run-validator-b.mjs, node --check scripts/validate-handoffs.mjs, node --check scripts/audit-harness.mjs, npm run run:validator-b -- ... --dry-run, npm run audit:harness, and git diff --check."
    }
  ],
  "errors": [],
  "github_commit": null,
  "tier_reclassification_needed": false,
  "tier_reclassification_reason": null,
  "log": [
    {
      "timestamp": "2026-04-30T00:00:00Z",
      "action": "Read validation context",
      "result": "Reviewed required architecture/security/validator docs, validator result schema, Task Spec, ledger, Generator result, changed files, Validator-B handoff fixture, and validation evidence artifact."
    },
    {
      "timestamp": "2026-04-30T00:00:00Z",
      "action": "Performed static validation",
      "result": "Verified package command, Validator-B handoff guard, secret preflight coverage, artifact paths, audit checks, fixture validation, and guide updates."
    },
    {
      "timestamp": "2026-04-30T00:00:00Z",
      "action": "Attempted executable validation",
      "result": "node/npm commands were rejected by the current read-only policy; accepted the referenced validation-evidence.json artifact as proof of successful local node --check, dry-run, npm run audit:harness, and git diff --check."
    }
  ]
}
