{"task_id":"TASK-20260430-001","agent":"Validator-A","tool":"Codex CLI","tier":"Tier2","verdict":"FAIL","criteria_results":[{"criterion":"package.json exposes a run:validator-b command.","result":"PASS","detail":"Static inspection shows package.json includes \"run:validator-b\": \"node scripts/run-validator-b.mjs\"."},{"criterion":"scripts/run-validator-b.mjs exists and can execute in dry-run mode without invoking Gemini.","result":"FAIL","detail":"The script exists and dry-run logic is present, but the required dry-run command could not be executed in this validation environment because node/npm execution was rejected by policy."},{"criterion":"Validator-B runner writes normalized run metadata and result artifacts under tasks/handoffs/{TASK-ID}/.","result":"PASS","detail":"Static inspection shows non-dry-run paths under tasks/handoffs/<task>: validator-b-run-<attempt>.json, validator-b-stdout-<attempt>.json, validator-b-stderr-<attempt>.log, validator-b-prompt-<attempt>.txt, and expected validator-b-result*.json."},{"criterion":"Validator-B runner rejects handoffs with agent values other than Validator-B.","result":"PASS","detail":"Static inspection shows parseHandoff throws unless data.agent is exactly Validator-B."},{"criterion":"Validator-B runner performs the same common secret-like payload preflight as Generator and Validator-A before invoking a model CLI.","result":"PASS","detail":"Static inspection shows assertNoSecretLikeContent is applied to the raw handoff, included context files, and the assembled Validator-B prompt before spawning Gemini."},{"criterion":"Harness audit includes Validator-B pipeline checks.","result":"PASS","detail":"Static inspection shows scripts/audit-harness.mjs checks package.json and run-validator-b.mjs for Validator-B command, handoff rejection, independence, and prompt secret preflight markers."},{"criterion":"Relevant guides no longer imply Validator-B is missing after implementation.","result":"PASS","detail":"Static inspection shows validator and generator pipeline guides were updated to describe Validator-B Gemini CLI wrapper, Tier 3 independent handoff, and resource-failure handling."},{"criterion":"node --check and npm run audit:harness pass.","result":"FAIL","detail":"git diff --check completed successfully, but node --check scripts/run-validator-b.mjs and npm run audit:harness were rejected by local execution policy before they could run."}],"errors":[{"severity":"HIGH","evidence_type":"EXECUTION_PROVEN","location":"validation commands: node --check scripts/run-validator-b.mjs; npm run audit:harness; npm run run:validator-b -- TASK-20260430-001 --input tasks/handoffs/TASK-20260430-001/validator-b-input.json --gemini-bin gemini --attempt 1 --dry-run","description":"Required executable validation could not be completed because node/npm commands were blocked by the current policy, so the dry-run and audit pass criteria are not proven.","suggestion":"Re-run Validator-A in an environment where read-only node/npm validation commands are permitted, then execute node --check scripts/run-validator-b.mjs, npm run run:validator-b -- TASK-20260430-001 --input tasks/handoffs/TASK-20260430-001/validator-b-input.json --gemini-bin gemini --attempt 1 --dry-run, and npm run audit:harness.","evidence":"Tool returned rejected: blocked by policy for node --check scripts/run-validator-b.mjs, npm run run:validator-b ... --dry-run, and npm run audit:harness. git diff --check exited 0 with only line-ending warnings."}],"github_commit":null,"tier_reclassification_needed":false,"tier_reclassification_reason":null,"log":[{"timestamp":"2026-04-30T00:00:00+09:00","action":"Read required validator context and task artifacts","result":"Reviewed ARCHITECTURE.md, SECURITY.md, docs/agents/validator.md, Task Spec, Generator result, package.json, runner script, audit script, handoff validator, guides, fixture handoff, and ledger."},{"timestamp":"2026-04-30T00:00:00+09:00","action":"Performed static validation","result":"Found required package command, Validator-B agent guard, secret preflight calls, artifact path writes, audit checks, and guide updates."},{"timestamp":"2026-04-30T00:00:00+09:00","action":"Attempted required executable validation","result":"node/npm validation commands were rejected by policy; git diff --check passed with line-ending warnings only."}]}