{
  "task_id": "TASK-20260429-017",
  "agent": "Validator-A",
  "tool": "Codex CLI",
  "tier": "Tier2",
  "verdict": "PASS",
  "criteria_results": [
    {
      "criterion": "smoke-target.md exists and contains the exact line: Generator smoke target created for TASK-20260429-015.",
      "result": "PASS",
      "detail": "Read tasks/handoffs/TASK-20260429-015/smoke-target.md; content is exactly the required line with trailing newline only."
    },
    {
      "criterion": "Generator result status is PENDING_VALIDATION.",
      "result": "PASS",
      "detail": "Read tasks/handoffs/TASK-20260429-015/generator-result.json; status is PENDING_VALIDATION."
    },
    {
      "criterion": "Generator result artifact list includes tasks/handoffs/TASK-20260429-015/smoke-target.md.",
      "result": "PASS",
      "detail": "Generator result artifacts array contains path tasks/handoffs/TASK-20260429-015/smoke-target.md with action created."
    },
    {
      "criterion": "No secrets, credentials, PII, or environment variable values are present in the smoke target or Generator result.",
      "result": "PASS",
      "detail": "Reviewed smoke-target.md and generator-result.json contents; no secrets, credentials, PII, or environment variable values were observed."
    },
    {
      "criterion": "Resource Failure, if any, must not be treated as Validator FAIL.",
      "result": "PASS",
      "detail": "No Resource Failure condition was observed during validation of the referenced files."
    }
  ],
  "errors": [],
  "github_commit": null,
  "tier_reclassification_needed": false,
  "tier_reclassification_reason": null,
  "log": [
    {
      "timestamp": "2026-04-29T16:16:30+09:00",
      "action": "read_task_spec",
      "result": "Loaded tasks/specs/TASK-20260429-017.json and confirmed Tier2 smoke-validation scope."
    },
    {
      "timestamp": "2026-04-29T16:16:31+09:00",
      "action": "read_generator_result",
      "result": "Loaded tasks/handoffs/TASK-20260429-015/generator-result.json and verified status and artifact path."
    },
    {
      "timestamp": "2026-04-29T16:16:32+09:00",
      "action": "read_smoke_target",
      "result": "Loaded tasks/handoffs/TASK-20260429-015/smoke-target.md and verified exact required line."
    },
    {
      "timestamp": "2026-04-29T16:16:33+09:00",
      "action": "security_review",
      "result": "Reviewed referenced smoke target and Generator result for secrets, credentials, PII, and environment variable values; none observed."
    }
  ]
}
